url,title,media,height_cm,width_cm,price_gbp
https://www.bearspace.co.uk/product-page/p10-by-olly-fathers,P10 by Olly Fathers,Acrylic paint on sprayed board,30,30,240.0
https://www.bearspace.co.uk/product-page/off-road-by-lucy-baker,OFF ROAD by Lucy Baker,"Oil paint, spray paint & gold leaf on board",30,30,340.0
https://www.bearspace.co.uk/product-page/amazons-by-lucy-baker,Amazons by Lucy Baker,"Oil paint, spray paint & gold leaf on board",110,110,1600.0
https://www.bearspace.co.uk/product-page/the-hurricane-by-lucy-baker,The Hurricane by Lucy Baker,"Oil paint, spray paint & gold leaf on board",110,110,1600.0
https://www.bearspace.co.uk/product-page/overland-i-by-jane-ward,Overland I by Jane Ward,"Archival Digital print on stretched canvas, finished with gold leaf",90,90,1400.0
https://www.bearspace.co.uk/product-page/candy-flop-by-olly-fathers,Candy Flop by Olly Fathers,Sprayed board,127,127,3400.0
https://www.bearspace.co.uk/product-page/crossroads-by-olly-fathers,Crossroads by Olly Fathers,Sprayed board,120,120,4000.0
https://www.bearspace.co.uk/product-page/tommy-by-olly-fathers,Tommy by Olly Fathers,"Spraypaint, board, card, digital print collage",100,100,1940.0
https://www.bearspace.co.uk/product-page/constructed-veneer-4-by-olly-fathers,Constructed Veneer IV by Olly Fathers,"Various wood veneers, various woods, board",38,38,1100.0
https://www.bearspace.co.uk/product-page/constructed-veneer-5-by-olly-fathers,Constructed Veneer V by Olly Fathers,"Various wood veneers, various woods, board",30,30,940.0
https://www.bearspace.co.uk/product-page/constructed-veneer-5-by-olly-fathers-1,Constructed Veneer VI by Olly Fathers,"Various wood veneers, various woods, board",26,26,940.0
https://www.bearspace.co.uk/product-page/constructed-veneer-vii-by-olly-fathers,Constructed Veneer VII by Olly Fathers,"Various wood veneers, various woods, board",34,34,940.0
https://www.bearspace.co.uk/product-page/collage-3-by-olly-fathers,Collage 3 by Olly Fathers,"Spraypaint, vinyl, card, digital print collage",29.7,29.7,175.0
https://www.bearspace.co.uk/product-page/collage-2-by-olly-fathers,Collage 2 by Olly Fathers,"Spraypaint, vinyl, card, digital print collage",29.7,29.7,175.0
https://www.bearspace.co.uk/product-page/collage-1-by-olly-fathers,Collage 1 by Olly Fathers,"Spraypaint, vinyl, card, digital print collage",29.7,29.7,175.0
https://www.bearspace.co.uk/product-page/c6-by-olly-fathers,C6 by Olly Fathers,Acrylic paint on sprayed board,30,30,240.0
https://www.bearspace.co.uk/product-page/c13-by-olly-fathers,C13 by Olly Fathers,Acrylic paint on sprayed board,30,30,240.0
https://www.bearspace.co.uk/product-page/p1-by-olly-fathers,P1 by Olly Fathers,Acrylic paint on sprayed board,30,30,240.0
https://www.bearspace.co.uk/product-page/portal-7-by-jane-ward,Portal 7 by Jane Ward,Digital print under acrylic with subframe,,,490.0
https://www.bearspace.co.uk/product-page/portal-8-by-jane-ward,Portal 8 by Jane Ward,Digital print under acrylic with subframe,,,490.0
https://www.bearspace.co.uk/product-page/portal-9-by-jane-ward,Portal 9 by Jane Ward,Digital print under acrylic with subframe,,,490.0
https://www.bearspace.co.uk/product-page/as-the-tide-turned-by-dominic-bradnum,As The Tide Turned by Dominic Bradnum,"Oil with charcoal, watercolour and sand on canvas",100,100,1400.0
https://www.bearspace.co.uk/product-page/you-took-my-breath-away-by-dominic-bradnum,You Took My Breath Away by Dominic Bradnum,"oil on canvas with charcoal, watercolour and pencil",40,40,640.0
https://www.bearspace.co.uk/product-page/balancing-acts-i-by-elise-wootten,Balancing Acts I by Elise Wootten,Inkjet Print (Hahnemuhle Ultra-Smooth),40.7,40.7,400.0
https://www.bearspace.co.uk/product-page/balancing-acts-ii-by-elise-wootten,Balancing Acts II by Elise Wootten,Inkjet Print (Hahnemuhle Ultra-Smooth),40.7,40.7,400.0
https://www.bearspace.co.uk/product-page/balancing-acts-iii-by-elise-wootten,Balancing Acts III by Elise Wootten,Inkjet Print (Hahnemuhle Ultra-Smooth),40.7,40.7,400.0
https://www.bearspace.co.uk/product-page/balancing-acts-iv-by-elise-wootten,Balancing Acts IV by Elise Wootten,Inkjet Print (Hahnemuhle Ultra-Smooth),40.7,40.7,400.0
https://www.bearspace.co.uk/product-page/balancing-acts-v-by-elise-wootten,Balancing Acts V by Elise Wootten,Inkjet Print (Hahnemuhle Ultra-Smooth),40.7,40.7,340.0
https://www.bearspace.co.uk/product-page/somewhat-confusing-i-by-elise-wootten,Somewhat Confusing I by Elise Wootten,"Aluminium, Inkjet Vinyl Print",74,74,640.0
https://www.bearspace.co.uk/product-page/somewhat-confusing-ii-by-elise-wootten,Somewhat Confusing II by Elise Wootten,"Aluminium, Inkjet Vinyl Print",75,75,640.0
https://www.bearspace.co.uk/product-page/somewhat-confusing-iii-by-elise-wootten,Somewhat Confusing III by Elise Wootten,"Aluminium, Inkjet Vinyl Print",75,75,640.0
https://www.bearspace.co.uk/product-page/all-recognisable-entities-by-elise-wootten,All Recognisable Entities by Elise Wootten,Set of four,40.9,40.9,1200.0
https://www.bearspace.co.uk/product-page/the-ephemeral-isles-by-jane-ward,The Ephemeral Isles by Jane Ward,Archival digital print on canvas with dissolved canvas,90,90,1400.0
https://www.bearspace.co.uk/product-page/to-the-zenith-s-height-by-jane-ward,To The Zenith's Height by Jane Ward,Archival digital print on canvas with dissolved canvas,90,90,1400.0
https://www.bearspace.co.uk/product-page/from-steep-to-steep-by-jane-ward,From Steep to Steep by Jane Ward,Digital print on Aluminium,45,45,640.0
https://www.bearspace.co.uk/product-page/castle-2-by-jane-ward,Castle 2 by Jane Ward,Digital print on Aluminium,45,45,640.0
https://www.bearspace.co.uk/product-page/unfathomable-deeps-by-jane-ward-1,Unfathomable Deeps by Jane Ward,Digital print on Aluminium,24,24,340.0
https://www.bearspace.co.uk/product-page/from-frozen-floods-by-jane-ward-1,From Frozen Floods by Jane Ward,Digital print on Aluminium,24,24,340.0
https://www.bearspace.co.uk/product-page/the-ephemeral-isles-5a-by-jane-ward,The Ephemeral Isles 5 by Jane Ward,Digital print on canvas with dissolved ink,45,45,490.0
https://www.bearspace.co.uk/product-page/copy-of-meld-5,Meld 5,"13K gold leaf, copper leaf, white casting cement, iron and pigment",17,17,420.0
https://www.bearspace.co.uk/product-page/portal-1-by-jane-ward,Portal 1 by Jane Ward,Digital print under acrylic with subframe,,,320.0
https://www.bearspace.co.uk/product-page/fragmentation-no-46-by-jim-cheatle,FRAGMENTATION No.46 by Jim Cheatle,"Resin, pigments, indian ink, watercolour paper, inkjet prints, MDF",70,70,1200.0
https://www.bearspace.co.uk/product-page/fragmentation-no-44-by-jim-cheatle,FRAGMENTATION No.44 by Jim Cheatle,"Resin, pigments, inkjet prints, canvas, MDF",70,70,1200.0
https://www.bearspace.co.uk/product-page/fragmentation-no-45-by-jim-cheatle,FRAGMENTATION No.45 by Jim Cheatle,"Resin, pigments, inkjet prints, acrylic, paper, MDF",70,70,1200.0
https://www.bearspace.co.uk/product-page/fragmentation-no-33-by-jim-cheatle,FRAGMENTATION No.33 by Jim Cheatle,"Resin, pigments, canvas, paper, inkjet prints, MDF",70,70,1200.0
https://www.bearspace.co.uk/product-page/fragmentation-no-17-by-jim-cheatle,FRAGMENTATION No.17 by Jim Cheatle,"Resin, pigments, canvas, paper, inkjet prints, MDF",70,70,1200.0
https://www.bearspace.co.uk/product-page/fragmentation-no-10-by-jim-cheatle,FRAGMENTATION No.10 by Jim Cheatle,"Resin, pigments, paper, indian ink, inkjet prints, MDF",70,70,1200.0
https://www.bearspace.co.uk/product-page/fragstudy-1-by-jim-cheatle,Fragstudy 1 by Jim Cheatle,"Resin, pigments, inkjet prints, MDF",30.5,30.5,490.0
https://www.bearspace.co.uk/product-page/fragstudy-2-by-jim-cheatle,Fragstudy 2 by Jim Cheatle,"Resin, pigments, inkjet prints, MDF",30.5,30.5,490.0
https://www.bearspace.co.uk/product-page/fragstudy-3-by-jim-cheatle,Fragstudy 3 by Jim Cheatle,"Resin, pigments, inkjet prints, MDF",30.5,30.5,490.0
https://www.bearspace.co.uk/product-page/facet-by-vic-wright,Facet by Vic Wright,13k gold leaf and grey casting cement.,10,10,140.0
https://www.bearspace.co.uk/product-page/conversation-2-by-vic-wright,Conversation 2 by Vic Wright,Black and white casting cement with 24k gold leaf,12,12,320.0
https://www.bearspace.co.uk/product-page/conversation-3-by-vic-wright,Conversation 3 by Vic Wright,"Fine white casting cement, ink, crystals and 24k gold leaf",12,12,340.0
https://www.bearspace.co.uk/product-page/green-sanctuary-by-dionne-cole,Green Sanctuary by Dionne Cole,Sculpted hand and laser cut paper,58,58,1200.0
https://www.bearspace.co.uk/product-page/facet-2-by-vic-wright,Facet 2 by Vic Wright,"24k gold leaf, white casting cement and ink",7,7,140.0
https://www.bearspace.co.uk/product-page/facet-3-by-vic-wright,Facet 3 by Vic Wright,"Fine white casting cement, ink and 18k gold",7,7,140.0
https://www.bearspace.co.uk/product-page/facet-4-by-vic-wright,Facet 4 by Vic Wright,Fine white casting cement and 24k gold leaf,7.5,7.5,140.0
https://www.bearspace.co.uk/product-page/facet-5-by-vic-wright,Facet 5 by Vic Wright,"Fine white casting cement, ink and 24k gold leaf",8,8,140.0
https://www.bearspace.co.uk/product-page/shades-of-coral-ii-by-dionne-cole,Shades of Coral II by Dionne Cole,Sculpted hand and laser cut paper,30.5,30.5,490.0
https://www.bearspace.co.uk/product-page/flight-by-dionne-cole,Flight by Dionne Cole,Sculpted hand and laser cut paper,92,92,2800.0
https://www.bearspace.co.uk/product-page/i-see-beauty-in-everything-by-dominic-badnum,I See Beauty In Everything by Dominic Badnum,oil on canvas with charcoal and watercolour,80,100,1600.0
https://www.bearspace.co.uk/product-page/the-tide-seems-to-whisper-your-name-by-dominic-badnum,The Tide Seems To Whisper Your Name by Dominic Badnum,oil on canvas,80,100,1600.0
https://www.bearspace.co.uk/product-page/take-my-hand-by-dominic-badnum,Take My Hand by Dominic Badnum,oil on canvas with charcoal and watercolour,40,40,840.0
https://www.bearspace.co.uk/product-page/you-took-my-breath-away-by-dominic-badnum,This Day Is Ours by Dominic Bradnum,"oil with charcoal, watercolour and pencil on canvas",40,40,640.0
https://www.bearspace.co.uk/product-page/disperse-by-dionne-cole,Disperse by Dionne Cole,"Sculpted hand and laser cut paper, pins",76,76,1400.0
https://www.bearspace.co.uk/product-page/purple-motion-by-dionne-cole,Purple Motion by Dionne Cole,"Sculpted hand and laser cut paper, pins",59.4,59.4,1200.0
https://www.bearspace.co.uk/product-page/meld-4-by-vic-wright,Meld 4 by Vic Wright,"13K gold leaf, copper leaf, white casting cement, iron and pigment",18,18,440.0
https://www.bearspace.co.uk/product-page/and-the-sunset-by-jane-ward,And The Sunset by Jane Ward,Digital print on Canvas with hand dissolved ink,70,70,840.0
https://www.bearspace.co.uk/product-page/to-the-zenith-sheight-by-jane-ward,To The Zenith'sHeight by Jane Ward,Digital print on canvas with dissolved ink and pigment,90,90,1400.0
https://www.bearspace.co.uk/product-page/from-the-curved-horizon-by-jane-ward,From the Curved Horizon by Jane Ward,Digital print on canvas with dissolved ink and gold leaf,90,90,1400.0
https://www.bearspace.co.uk/product-page/spangled-by-john-greenwood,Spangled by John Greenwood,Oil on Canvas,35,35,3000.0
https://www.bearspace.co.uk/product-page/el-dorado-by-john-greenwood,El Dorado by John Greenwood,Oil on Gessoed canvas on Board,45,45,3800.0
https://www.bearspace.co.uk/product-page/museum-of-now-by-john-greenwood,Museum of now by John Greenwood,Oil on Gessoed canvas on Board,45,45,9800.0
https://www.bearspace.co.uk/product-page/entry-point-by-joseph-stokes,Entry Point by Joseph Stokes,Graphite on paper,50,50,720.0
https://www.bearspace.co.uk/product-page/where-stars-dissolve-by-bella-easton,Where Stars Dissolve by Bella Easton,Pencil on Arches paper,56,56,3200.0
https://www.bearspace.co.uk/product-page/angel-heart-by-bella-easton,ANGEL HEART by Bella Easton,Pencil on Arches paper,56,56,3200.0
https://www.bearspace.co.uk/product-page/white-sitting-double-by-vic-wright,White Sitting Double by Vic Wright,24K gold leaf & white casting cement,13.5,13.5,290.0
https://www.bearspace.co.uk/product-page/standing-triple-black-grey-and-white-by-vic-wright,Standing Triple Black Grey and White by Vic Wright,White and grey casting cement with ink,14,14,340.0
https://www.bearspace.co.uk/product-page/meld-3-by-vic-wright,Meld 3 by Vic Wright,"13k gold leaf, white casting cement and ink",18,18,440.0
https://www.bearspace.co.uk/product-page/standing-white-and-grey-speckle-by-vic-wright,Standing White and Grey speckle by Vic Wright,White and Grey fine casting cement with white wax,14,14,325.0
https://www.bearspace.co.uk/product-page/standing-triple-grey-and-black-by-vic-wright,Standing Triple Grey and Black by Vic Wright,24k gold leaf with casting cement,15,15,380.0
https://www.bearspace.co.uk/product-page/standing-grey-double-by-vic-wright,Standing Grey double by Vic Wright,Grey casting cement,12,12,180.0
https://www.bearspace.co.uk/product-page/standing-white-black-gold-by-vic-wright,"Standing White , black & gold by Vic Wright","Lichen gilded with 24k gold leaf, moss with ground copper, and white casting cement",12,12,280.0
https://www.bearspace.co.uk/product-page/meld-1-by-vic-wright,Meld 1 by Vic Wright,"24k gold leaf, white casting cement and ground iron",17,17,440.0
https://www.bearspace.co.uk/product-page/emplacement-6-by-victoria-ashdown,Emplacement 6 by Victoria Ashdown,"porcelain, green acrylic, concrete, wire",20,20,240.0
https://www.bearspace.co.uk/product-page/emplacement-7-by-victoria-ashdown,Emplacement 7 by Victoria Ashdown,"Porcelain, orange acrylic, concrete, wire",13,13,240.0
https://www.bearspace.co.uk/product-page/follow-by-deanna-lewis,"""Follow"" by Deanna Lewis",Acrylic and oil paint on canvas,35,35,340.0
https://www.bearspace.co.uk/product-page/point-by-deanna-lewis,"""Point"" by Deanna Lewis",Acrylic and oil paint on canvas,35,35,340.0
https://www.bearspace.co.uk/product-page/exchange-by-deanna-lewis,"""Exchange"" by Deanna Lewis",Acrylic and oil paint on canvas,35,35,340.0
https://www.bearspace.co.uk/product-page/shift-by-deanna-lewis,"""Shift"" by Deanna Lewis",Acrylic and oil paint on canvas,40,40,440.0
https://www.bearspace.co.uk/product-page/push-by-deanna-lewis,"""Push"" by Deanna Lewis",Acrylic and oil paint on canvas,40,40,440.0
https://www.bearspace.co.uk/product-page/stroke-by-deanna-lewis,"""Stroke"" by Deanna Lewis",Acrylic and oil paint on canvas,40,40,440.0
https://www.bearspace.co.uk/product-page/the-reaches-by-chris-hawtin,The Reaches by Chris Hawtin,Oil on canvas,50,50,940.0
https://www.bearspace.co.uk/product-page/the-chaos-by-chris-hawtin,The Chaos by Chris Hawtin,Oil on canvas,50,50,940.0
https://www.bearspace.co.uk/product-page/with-tomorrow-by-chris-hawtin,With Tomorrow by Chris Hawtin,Oil on canvas,50,50,940.0
https://www.bearspace.co.uk/product-page/sshhh-by-dominic-bradnum,SSHHH by Dominic Bradnum,oil on canvas,40,40,640.0
https://www.bearspace.co.uk/product-page/message-of-undying-love-by-dominic-bradnum,Message Of Undying Love by Dominic Bradnum,"oil, watercolour, charcoal and ink on canvas",110,110,2400.0
https://www.bearspace.co.uk/product-page/wherever-you-go-i-will-follow-by-dominic-bradnum,"Wherever You Go, I Will Follow by Dominic Bradnum","oil, watercolour, charcoal and ink on canvas",70,70,1400.0
https://www.bearspace.co.uk/product-page/the-high-way-peak-by-jane-ward-1,The High Way (Peak) by Jane Ward,Digital print on Canvas with hand dissolved ink,90,90,940.0
https://www.bearspace.co.uk/product-page/unfathomable-deeps-by-jane-ward,Unfathomable Deeps by Jane Ward,Digital print on Canvas with hand dissolved ink,70,70,840.0
https://www.bearspace.co.uk/product-page/of-earth-air-and-water-by-jane-ward,"Of Earth, Air and Water by Jane Ward",Digital print on Canvas with hand dissolved ink,70,70,840.0
https://www.bearspace.co.uk/product-page/take-our-time-someday-by-chris-hawtin,Take Our Time (Someday) by Chris Hawtin,Oil and acrylic on canvas,40,40,640.0
https://www.bearspace.co.uk/product-page/embers-by-chris-hawtin,Embers by Chris Hawtin,Oil and acrylic on canvas,40,40,640.0
https://www.bearspace.co.uk/product-page/loneliness-by-chris-hawtin,Loneliness by Chris Hawtin,"Oil, acrylic and pigment on canvas",40,40,640.0
https://www.bearspace.co.uk/product-page/the-castle-by-chris-hawtin,The Castle by Chris Hawtin,Oil & acrylic on canvas,90,90,1400.0
https://www.bearspace.co.uk/product-page/the-mortal-frame-by-chris-hawtin,The Mortal Frame by Chris Hawtin,Oil & acrylic on canvas,99,99,1600.0
https://www.bearspace.co.uk/product-page/guiding-light-by-chris-hawtin,Guiding Light by Chris Hawtin,Oil & acrylic on canvas,40,40,695.0
https://www.bearspace.co.uk/product-page/sovereign,Sovereign,Mixed media,22,22,640.0
https://www.bearspace.co.uk/product-page/recon-drones-by-chris-hawtin,Recon Drones by Chris Hawtin,Mixed media,22,22,640.0
https://www.bearspace.co.uk/product-page/copy-of-recon-drones-by-chris-hawtin,copy of Recon Drones by Chris Hawtin,Mixed media,22,22,640.0
https://www.bearspace.co.uk/product-page/capital-drone-by-chris-hawtin,Capital Drone by Chris Hawtin,Mixed media,22,22,640.0
https://www.bearspace.co.uk/product-page/factory-by-chris-hawtin,Factory by Chris Hawtin,Mixed media,22,22,640.0
https://www.bearspace.co.uk/product-page/bridge-over-garden-city-state-by-jane-ward,Bridge Over Garden City State by Jane Ward,Archival digital print on canvas,90,90,1800.0
https://www.bearspace.co.uk/product-page/the-high-way-peak-by-jane-ward,The High Way (Pass) by Jane Ward,Digital print on Canvas with hand dissolved ink,90,90,940.0
https://www.bearspace.co.uk/product-page/yellow-wall-by-lucinda-metcalfe-1,Yellow Wall by Lucinda Metcalfe,Oil Paint and acrylic on board,60,60,1200.0
https://www.bearspace.co.uk/product-page/skywalk-by-jane-ward,Skywalk by Jane Ward,Digital print on Canvas with dissolved ink,90,90,940.0
https://www.bearspace.co.uk/product-page/emplacement-1-by-victoria-ashdown,Emplacement 1 by Victoria Ashdown,"Porcelain, red acrylic, steel, wire",30,30,140.0
https://www.bearspace.co.uk/product-page/emplacement-2-by-victoria-ashdown,Emplacement 2 by Victoria Ashdown,"Yellow acrylic, steel and wire",26,26,180.0
https://www.bearspace.co.uk/product-page/myriorama-room-series-lamp-by-bella-easton,MYRIORAMA ROOM series - LAMP by Bella Easton,88 hand coloured copper plate etchings on 400gsm Velin Arches and conservation board,89,89,2800.0
https://www.bearspace.co.uk/product-page/myriorama-room-series-fireplace-ii-by-bella-easton,MYRIORAMA ROOM series – FIREPLACE II by Bella Easton,88 hand coloured copper plate etchings on 400gsm Velin Arches and conservation board,89,89,2800.0
https://www.bearspace.co.uk/product-page/chiral-vi-by-bella-easton,Chiral VI by Bella Easton,Watercolour and hand coloured copper plate etching on Velin Arches,40,40,940.0
https://www.bearspace.co.uk/product-page/chiral-v-by-bella-easton,Chiral V by Bella Easton,Watercolour and hand coloured copper plate etching on Velin Arches,40,40,940.0
https://www.bearspace.co.uk/product-page/chiral-iv-by-bella-easton,Chiral IV by Bella Easton,Watercolour and hand coloured copper plate etching on Velin Arches,40,40,940.0
https://www.bearspace.co.uk/product-page/chiral-iii-by-bella-easton,Chiral III by Bella Easton,Watercolour and hand coloured copper plate etching on Velin Arches,40,40,940.0
https://www.bearspace.co.uk/product-page/chiral-ii-by-bella-easton,Chiral II by Bella Easton,Watercolour and hand coloured copper plate etching on Velin Arches,40,40,940.0
https://www.bearspace.co.uk/product-page/overland-2-by-jane-ward,Overland 2 by Jane Ward,Archival digital print on canvas,90,90,1400.0
https://www.bearspace.co.uk/product-page/overland-1-by-jane-ward,Overland 1 by Jane Ward,Archival digital print on canvas,90,90,1400.0
https://www.bearspace.co.uk/product-page/overland-3-by-jane-ward,Overland 3 by Jane Ward,Archival digital print on canvas,90,90,1400.0
https://www.bearspace.co.uk/product-page/overland-4-by-jane-ward,Overland 4 by Jane Ward,Archival digital print on canvas,90,90,1400.0
https://www.bearspace.co.uk/product-page/alpine-1-by-jane-ward,Alpine 1 by Jane Ward,Digital print on canvas with hand dissolved ink,40,40,290.0
https://www.bearspace.co.uk/product-page/alpine-2-by-jane-ward,Alpine 2 by Jane Ward,Digital print on canvas with hand dissolved ink,40,40,290.0
https://www.bearspace.co.uk/product-page/alpine-3-by-jane-ward,Alpine 4 by Jane Ward,Digital print on canvas with hand dissolved ink,40,40,290.0
https://www.bearspace.co.uk/product-page/summer-breeze-by-lucinda-metcalfe,Summer Breeze by Lucinda Metcalfe,Framed (piece float mounted in white box frame),57.5,57.5,690.0
https://www.bearspace.co.uk/product-page/alpine-3-by-jane-ward-1,Alpine 3 by Jane Ward,Digital print on canvas with hand dissolved ink,40,40,290.0
https://www.bearspace.co.uk/product-page/yeti-over-mount-fuji-pantone-yellow-by-phil-ashcroft,YETI OVER MOUNT FUJI (PANTONE YELLOW) by Phil Ashcroft,screenprint on paper,59.4,59.4,150.0
https://www.bearspace.co.uk/product-page/ennio-fallen-by-chris-hawtin,Ennio Fallen by Chris Hawtin,"Oil, enamel, acrylic and plaster on canvas",198,198,4000.0
https://www.bearspace.co.uk/product-page/garden-city-state-1b-by-jane-ward,Garden City State 1b by Jane Ward,Digital print with hand dissolved ink and gold leaf,60,60,490.0
https://www.bearspace.co.uk/product-page/garden-city-state-1c-by-jane-ward,Garden City State 1c by Jane Ward,Digital print with hand dissolved ink and gold leaf,60,60,490.0
https://www.bearspace.co.uk/product-page/then-all-was-calm,Then All Was Calm... by Dominic Bradnum,"Oil with charcoal, watercolour, salt & sand on canvas",110,150,2400.0
https://www.bearspace.co.uk/product-page/i-crash-into-your-arms,I Crash Into Your Arms by Dominic Bradnum,"Oil with charcoal, watercolour, salt & sand on canvas",70,100,1400.0
https://www.bearspace.co.uk/product-page/anxiety-machines,Anxiety Machines by Chris Hawtin,"Oil, enamel and acrylic on canvas",99,99,1600.0
https://www.bearspace.co.uk/product-page/under-a-bruised-and-leaden-sky-by-dominic-badnum,Under A Bruised And Leaden Sky by Dominic Badnum,Oil with charcoal & watercolour on canvas,100,100,1600.0
https://www.bearspace.co.uk/product-page/gregor-s-hollow-by-chris-hawtin,Gregor's Hollow by Chris Hawtin,"Oil, enamel, acrylic and resin on canvas",198,198,4000.0
https://www.bearspace.co.uk/product-page/jerome-s-peak-by-chris-hawtin,Jerome's Peak by Chris Hawtin,"Oil,enamel and acrylic on canvas",132,132,2400.0
https://www.bearspace.co.uk/product-page/photeus-at-the-pythia-by-chris-hawtin,Photeus at the Pythia by Chris Hawtin,Oil and acrylic on canvas,70,70,1200.0
https://www.bearspace.co.uk/product-page/protist-peak-by-chris-hawtin,Protist Peak by Chris Hawtin,Oil and acrylic on canvas,40,40,690.0
https://www.bearspace.co.uk/product-page/relic-engines-by-chris-hawtin,Relic Engines by Chris Hawtin,"Oil, enamel and acrylic on canvas",45,45,690.0
https://www.bearspace.co.uk/product-page/seth-s-narrows-by-chris-hawtin,Seth's Narrows by Chris Hawtin,Oil and acrylic on canvas,59,59,800.0
https://www.bearspace.co.uk/product-page/the-cope-marsh-station,The Cope Marsh Station by Chris Hawtin,Oil on canvas,86,86,1400.0
https://www.bearspace.co.uk/product-page/tilt-by-chris-hawton,Tilt by Chris Hawton,Oil and acrylic on canvas,51,51,800.0
https://www.bearspace.co.uk/product-page/the-scientist-by-chris-hawtin,The Scientist by Chris Hawtin,Screen print on paper,76,76,250.0
https://www.bearspace.co.uk/product-page/the-vandal-by-chris-hawtin,The Vandal by Chris Hawtin,Screenprint on paper,76,76,250.0
https://www.bearspace.co.uk/product-page/march-by-chris-hawtin,March by Chris Hawtin,Oil on Canvas,57,57,940.0
https://www.bearspace.co.uk/product-page/gcs-high-rise-jane-ward,(GCS) High Rise - Jane Ward,Digital print with dissolved ink,80,80,990.0
https://www.bearspace.co.uk/product-page/feralis-by-suzanne-moxhay,Feralis by Suzanne Moxhay,Archival Digital print,68,68,690.0
https://www.bearspace.co.uk/product-page/boondocks-by-suzanne-moxhay,Boondocks by Suzanne Moxhay,Archival Digital Print ,92,92,690.0
https://www.bearspace.co.uk/product-page/athne-by-suzanne-moxhay,Athne by Suzanne Moxhay,Archival Digital Print ,100,100,690.0
https://www.bearspace.co.uk/product-page/gloaming-by-suzanne-moxhay,Gloaming by Suzanne Moxhay,Archival Digital print,60,60,690.0
https://www.bearspace.co.uk/product-page/bayou,Bayou,Archival digital print,100,100,690.0
https://www.bearspace.co.uk/product-page/retreating-then-advancing-repeatedly-over-the-centuries-3-by-janie-kidston,"'Retreating, then advancing repeatedly over the centuries 3' by Janie Kidston",Archival inkjet print,50,50,540.0
https://www.bearspace.co.uk/product-page/retreating-then-advancing-repeatedly-over-the-centuries-5,"'Retreating, then advancing repeatedly over the centuries'5 by Janie Kidston",Archival inkjet print,50,50,540.0
https://www.bearspace.co.uk/product-page/retreating-then-advancing-repeatedly-over-the-centuries-6-by-janie-kidston,"'Retreating, then advancing repeatedly over the centuries 6' by Janie Kidston",Archival Inkjet Print,50,50,540.0
https://www.bearspace.co.uk/product-page/walking-out-over-ice-in-midsummer-1,Walking Out Over Ice in Midsummer 1 by Janie Kidston,Archival Digital Print,84,84,940.0
https://www.bearspace.co.uk/product-page/moving-from-the-side-of-the-vallery,Moving from the side of the valley by Janie Kidston,Archival digital print,50,50,540.0
https://www.bearspace.co.uk/product-page/neon-pool,Lucinda Metcalfe - Neon Pool,Acrylic and oil on board,39,39,640.0
https://www.bearspace.co.uk/product-page/jubellied-joy-song-by-nadja-gabriela-plein,Jubellied (joy song) by Nadja Gabriela Plein,Paint onto Aluminium with subframe,50,50,490.0
https://www.bearspace.co.uk/product-page/sky-walk-by-jane-ward,Sky Walk by Jane ward,Digital Print on Canvas with Dissolved ink,90,90,940.0
https://www.bearspace.co.uk/product-page/castle-by-jane-ward,Castle by Jane Ward,Digital print on Canvas with dissolved ink,90,90,940.0
